{
  "$schema": "https://json-schema.org/draft/2020-12/schema",
  "title": "LLM Wiki Function Budget Refactor Proposals",
  "type": "object",
  "additionalProperties": false,
  "required": [
    "$schema",
    "artifact_kind",
    "generated_at",
    "producer",
    "source_command",
    "source_revision",
    "source_tree_fingerprint",
    "input_fingerprints",
    "schema_version",
    "artifact_status",
    "retention_policy",
    "encoding",
    "currentness",
    "vault",
    "status",
    "policy",
    "classification_report",
    "summary",
    "owner_groups",
    "owner_backlog",
    "candidates",
    "proposals"
  ],
  "properties": {
    "$schema": {
      "type": "string",
      "const": "ops/schemas/function-budget-refactor-proposals.schema.json"
    },
    "artifact_kind": {
      "type": "string",
      "const": "function_budget_refactor_proposals"
    },
    "generated_at": {
      "type": "string",
      "pattern": "^\\d{4}-\\d{2}-\\d{2}T\\d{2}:\\d{2}:\\d{2}Z$"
    },
    "producer": {
      "type": "string",
      "const": "ops.scripts.function_budget_refactor_proposals"
    },
    "source_command": { "type": "string", "minLength": 1 },
    "source_revision": { "type": "string", "minLength": 1 },
    "source_tree_fingerprint": { "type": "string", "minLength": 1 },
    "input_fingerprints": {
      "type": "object",
      "additionalProperties": { "type": "string", "minLength": 1 }
    },
    "schema_version": { "type": "integer", "minimum": 1 },
    "artifact_status": {
      "type": "string",
      "enum": ["current", "archived", "stale", "unknown"]
    },
    "retention_policy": {
      "type": "string",
      "enum": ["canonical_report"]
    },
    "encoding": { "type": "string", "const": "utf-8" },
    "currentness": { "$ref": "#/$defs/currentness" },
    "vault": { "type": "string" },
    "status": { "type": "string", "const": "pass" },
    "policy": { "$ref": "#/$defs/policy_identity" },
    "classification_report": {
      "type": "object",
      "additionalProperties": false,
      "required": ["source", "status", "function_budget_count"],
      "properties": {
        "source": { "type": "string", "minLength": 1 },
        "status": { "type": "string" },
        "function_budget_count": { "type": "integer", "minimum": 0 }
      }
    },
    "summary": {
      "type": "object",
      "additionalProperties": false,
      "required": [
        "function_budget_candidate_count",
        "owner_group_count",
        "owner_backlog_count",
        "proposal_count",
        "large_main_without_tests_or_docs_count",
        "shared_runtime_helper_count",
        "non_proposal_candidate_count"
      ],
      "properties": {
        "function_budget_candidate_count": { "type": "integer", "minimum": 0 },
        "owner_group_count": { "type": "integer", "minimum": 0 },
        "owner_backlog_count": { "type": "integer", "minimum": 0 },
        "proposal_count": { "type": "integer", "minimum": 0 },
        "large_main_without_tests_or_docs_count": { "type": "integer", "minimum": 0 },
        "shared_runtime_helper_count": { "type": "integer", "minimum": 0 },
        "non_proposal_candidate_count": { "type": "integer", "minimum": 0 }
      }
    },
    "owner_groups": {
      "type": "array",
      "items": { "$ref": "#/$defs/owner_group" }
    },
    "owner_backlog": {
      "type": "array",
      "items": { "$ref": "#/$defs/owner_backlog_item" }
    },
    "candidates": {
      "type": "array",
      "items": { "$ref": "#/$defs/candidate" }
    },
    "proposals": {
      "type": "array",
      "items": { "$ref": "#/$defs/proposal" }
    }
  },
  "$defs": {
    "currentness": {
      "type": "object",
      "additionalProperties": false,
      "required": ["status", "checked_at"],
      "properties": {
        "status": {
          "type": "string",
          "enum": ["current", "stale", "unknown", "invalid"]
        },
        "checked_at": {
          "type": "string",
          "pattern": "^\\d{4}-\\d{2}-\\d{2}T\\d{2}:\\d{2}:\\d{2}Z$"
        }
      }
    },
    "policy_identity": {
      "type": "object",
      "additionalProperties": false,
      "required": ["path", "version"],
      "properties": {
        "path": { "type": "string" },
        "version": { "type": ["integer", "string", "null"] }
      }
    },
    "metrics": {
      "type": "object",
      "additionalProperties": false,
      "required": ["function_lines", "parameter_count", "branch_node_count"],
      "properties": {
        "function_lines": { "type": "integer", "minimum": 0 },
        "parameter_count": { "type": "integer", "minimum": 0 },
        "branch_node_count": { "type": "integer", "minimum": 0 }
      }
    },
    "owner_group": {
      "type": "object",
      "additionalProperties": false,
      "required": [
        "owner_surface",
        "scope_class",
        "candidate_count",
        "proposal_count",
        "high_risk_count",
        "medium_risk_count",
        "low_risk_count"
      ],
      "properties": {
        "owner_surface": { "type": "string", "minLength": 1 },
        "scope_class": { "$ref": "#/$defs/scope_class" },
        "candidate_count": { "type": "integer", "minimum": 0 },
        "proposal_count": { "type": "integer", "minimum": 0 },
        "high_risk_count": { "type": "integer", "minimum": 0 },
        "medium_risk_count": { "type": "integer", "minimum": 0 },
        "low_risk_count": { "type": "integer", "minimum": 0 }
      }
    },
    "candidate": {
      "type": "object",
      "additionalProperties": false,
      "required": [
        "page",
        "symbol",
        "line",
        "profile",
        "owner_surface",
        "scope_class",
        "risk_tier",
        "triggered_budgets",
        "metrics",
        "thresholds",
        "overages",
        "direct_test_path",
        "has_direct_test",
        "has_doc_reference",
        "proposal_eligible",
        "proposal_blockers"
      ],
      "properties": {
        "page": { "type": "string", "minLength": 1 },
        "symbol": { "type": "string" },
        "line": { "type": "integer", "minimum": 0 },
        "profile": { "type": "string" },
        "owner_surface": { "type": "string", "minLength": 1 },
        "scope_class": { "$ref": "#/$defs/scope_class" },
        "risk_tier": { "type": "string", "enum": ["low", "medium", "high"] },
        "triggered_budgets": {
          "type": "array",
          "items": { "type": "string", "minLength": 1 }
        },
        "metrics": { "$ref": "#/$defs/metrics" },
        "thresholds": { "$ref": "#/$defs/metrics" },
        "overages": { "$ref": "#/$defs/metrics" },
        "direct_test_path": { "type": "string" },
        "has_direct_test": { "type": "boolean" },
        "has_doc_reference": { "type": "boolean" },
        "proposal_eligible": { "type": "boolean" },
        "proposal_blockers": {
          "type": "array",
          "items": { "type": "string", "minLength": 1 }
        }
      }
    },
    "owner_backlog_item": {
      "type": "object",
      "additionalProperties": false,
      "required": [
        "backlog_id",
        "owner_surface",
        "scope_class",
        "backlog_theme",
        "priority",
        "candidate_count",
        "high_risk_count",
        "medium_risk_count",
        "low_risk_count",
        "dominant_blockers",
        "candidate_symbols",
        "recommended_strategy",
        "next_owner_action"
      ],
      "properties": {
        "backlog_id": {
          "type": "string",
          "pattern": "^[a-z0-9][a-z0-9_-]*$"
        },
        "owner_surface": { "type": "string", "minLength": 1 },
        "scope_class": { "$ref": "#/$defs/scope_class" },
        "backlog_theme": {
          "type": "string",
          "enum": [
            "learning_release_report_builders",
            "external_report_reference_manifest_request_object",
            "mechanism_run_request_helpers",
            "test_helper_design_backlog",
            "owner_design_backlog"
          ]
        },
        "priority": { "type": "string", "enum": ["P0", "P1", "P2"] },
        "candidate_count": { "type": "integer", "minimum": 1 },
        "high_risk_count": { "type": "integer", "minimum": 0 },
        "medium_risk_count": { "type": "integer", "minimum": 0 },
        "low_risk_count": { "type": "integer", "minimum": 0 },
        "dominant_blockers": {
          "type": "array",
          "items": { "type": "string", "minLength": 1 }
        },
        "candidate_symbols": {
          "type": "array",
          "minItems": 1,
          "maxItems": 10,
          "items": { "type": "string", "minLength": 1 }
        },
        "recommended_strategy": { "type": "string", "minLength": 1 },
        "next_owner_action": { "type": "string", "minLength": 1 }
      }
    },
    "proposal": {
      "type": "object",
      "additionalProperties": false,
      "required": [
        "proposal_id",
        "page",
        "symbol",
        "line",
        "owner_surface",
        "scope_class",
        "recommended_action",
        "bounded_scope",
        "suggested_tests",
        "why_small"
      ],
      "properties": {
        "proposal_id": {
          "type": "string",
          "pattern": "^[a-z0-9][a-z0-9_-]*$"
        },
        "page": { "type": "string", "minLength": 1 },
        "symbol": { "type": "string" },
        "line": { "type": "integer", "minimum": 0 },
        "owner_surface": { "type": "string", "minLength": 1 },
        "scope_class": { "$ref": "#/$defs/scope_class" },
        "recommended_action": { "type": "string", "minLength": 1 },
        "bounded_scope": { "type": "string", "const": "single_function_adapter" },
        "suggested_tests": {
          "type": "array",
          "minItems": 1,
          "items": { "type": "string", "minLength": 1 }
        },
        "why_small": { "type": "string", "minLength": 1 }
      }
    },
    "scope_class": {
      "type": "string",
      "enum": [
        "large_main_without_tests_or_docs",
        "shared_runtime_helper",
        "script_or_report_helper",
        "test_helper",
        "other_python"
      ]
    }
  }
}
