{
  "$schema": "ops/schemas/function-budget-refactor-proposals.schema.json",
  "artifact_kind": "function_budget_refactor_proposals",
  "generated_at": "2026-05-23T05:47:42Z",
  "producer": "ops.scripts.function_budget_refactor_proposals",
  "source_command": "python -m ops.scripts.function_budget_refactor_proposals --vault .",
  "source_revision": "unknown",
  "source_tree_fingerprint": "2ff56a8d94dacbae5abacdc152b5658285be63a00631b29e39eb82149caaa31b",
  "input_fingerprints": {
    "policy": "db4a14398a7f56012e4809c9641e5272afd043bf7bd0f600e794266123b0ec24",
    "schema": "95f193f4886d760375b6e0528a8a9a9bc005c88934387a357d181e03af358634",
    "artifact_envelope_schema": "87fcb7b91ffc04e8180c1c3e51e309cde186ecf23f91f7974a541d0b580976de",
    "source_paths": "309c4dcd9b669614b836a845adb67660ff17204733831a92fa860caed37ee9c4",
    "classification_report": "90ae3bcc5eb6f5f86f90b86be54bc52f7d4576ad3184e24953267a8470adf72a",
    "classification_source": "5c51928076384d942097653b9d11de2ef107182b49249dc95a3e8286da6ec0d8",
    "small_adapter_limits": "b4256e8722ca1ad5a2f69f3f096619290caaf9b7e494ddbe85e1ad6282af66fe"
  },
  "schema_version": 1,
  "artifact_status": "current",
  "retention_policy": "canonical_report",
  "encoding": "utf-8",
  "currentness": {
    "status": "current",
    "checked_at": "2026-05-23T05:47:42Z"
  },
  "vault": ".",
  "status": "pass",
  "policy": {
    "path": "ops/policies/wiki-maintainer-policy.yaml",
    "version": 4
  },
  "classification_report": {
    "source": "tmp/wiki-lint-review-classification.json",
    "status": "pass",
    "function_budget_count": 21
  },
  "summary": {
    "function_budget_candidate_count": 21,
    "owner_group_count": 7,
    "owner_backlog_count": 6,
    "proposal_count": 8,
    "large_main_without_tests_or_docs_count": 0,
    "shared_runtime_helper_count": 5,
    "non_proposal_candidate_count": 13
  },
  "owner_groups": [
    {
      "owner_surface": "ops/scripts",
      "scope_class": "script_or_report_helper",
      "candidate_count": 9,
      "proposal_count": 4,
      "high_risk_count": 0,
      "medium_risk_count": 3,
      "low_risk_count": 6
    },
    {
      "owner_surface": "ops/scripts",
      "scope_class": "shared_runtime_helper",
      "candidate_count": 5,
      "proposal_count": 1,
      "high_risk_count": 1,
      "medium_risk_count": 4,
      "low_risk_count": 0
    },
    {
      "owner_surface": "tests/test_external_report_action_matrix.py",
      "scope_class": "test_helper",
      "candidate_count": 1,
      "proposal_count": 0,
      "high_risk_count": 0,
      "medium_risk_count": 1,
      "low_risk_count": 0
    },
    {
      "owner_surface": "tests/test_generated_report_contracts.py",
      "scope_class": "test_helper",
      "candidate_count": 1,
      "proposal_count": 0,
      "high_risk_count": 0,
      "medium_risk_count": 0,
      "low_risk_count": 1
    },
    {
      "owner_surface": "tests/test_makefile_static_gates.py",
      "scope_class": "test_helper",
      "candidate_count": 3,
      "proposal_count": 1,
      "high_risk_count": 0,
      "medium_risk_count": 2,
      "low_risk_count": 1
    },
    {
      "owner_surface": "tests/test_release_workflow_order_guard.py",
      "scope_class": "test_helper",
      "candidate_count": 1,
      "proposal_count": 1,
      "high_risk_count": 0,
      "medium_risk_count": 0,
      "low_risk_count": 1
    },
    {
      "owner_surface": "tests/test_run_mechanism_experiment.py",
      "scope_class": "test_helper",
      "candidate_count": 1,
      "proposal_count": 1,
      "high_risk_count": 0,
      "medium_risk_count": 0,
      "low_risk_count": 1
    }
  ],
  "owner_backlog": [
    {
      "backlog_id": "function-budget-ops-scripts-learning-release-report-builders-1",
      "owner_surface": "ops/scripts",
      "scope_class": "script_or_report_helper",
      "backlog_theme": "learning_release_report_builders",
      "priority": "P0",
      "candidate_count": 1,
      "high_risk_count": 0,
      "medium_risk_count": 1,
      "low_risk_count": 0,
      "dominant_blockers": [
        "function_line_overage_too_large_for_small_adapter"
      ],
      "candidate_symbols": [
        "ops/scripts/release/release_source_ready_commit.py::run_commit:512"
      ],
      "recommended_strategy": "stabilize_report_assembly_steps_before_helper_split",
      "next_owner_action": "Pin direct report tests, then name assembly phases so evidence-policy decisions stay reviewable."
    },
    {
      "backlog_id": "function-budget-ops-scripts-mechanism-run-request-helpers-4",
      "owner_surface": "ops/scripts",
      "scope_class": "shared_runtime_helper",
      "backlog_theme": "mechanism_run_request_helpers",
      "priority": "P1",
      "candidate_count": 4,
      "high_risk_count": 1,
      "medium_risk_count": 3,
      "low_risk_count": 0,
      "dominant_blockers": [
        "parameter_overage_too_large_for_small_adapter",
        "multiple_budget_axes_triggered",
        "branch_overage_too_large_for_small_adapter",
        "function_line_overage_too_large_for_small_adapter",
        "high_risk_shared_or_large_function"
      ],
      "candidate_symbols": [
        "ops/scripts/core/command_runtime.py::_result_from_completed_process:319",
        "ops/scripts/core/command_runtime.py::run_with_timeout:504",
        "ops/scripts/mechanism/auto_improve_next_run_decision_runtime.py::build_next_run_decision:247",
        "ops/scripts/release/external_report_lifecycle_runtime.py::status_from_evidence:1669"
      ],
      "recommended_strategy": "apply_request_object_pattern_incrementally",
      "next_owner_action": "Pick one mechanism-run helper surface at a time and preserve existing routing contracts."
    },
    {
      "backlog_id": "function-budget-ops-scripts-owner-design-backlog-4",
      "owner_surface": "ops/scripts",
      "scope_class": "script_or_report_helper",
      "backlog_theme": "owner_design_backlog",
      "priority": "P2",
      "candidate_count": 4,
      "high_risk_count": 0,
      "medium_risk_count": 2,
      "low_risk_count": 2,
      "dominant_blockers": [
        "parameter_overage_too_large_for_small_adapter",
        "function_line_overage_too_large_for_small_adapter",
        "multiple_budget_axes_triggered"
      ],
      "candidate_symbols": [
        "ops/scripts/core/codex_goal_client.py::build_auto_improve_goal_contract:354",
        "ops/scripts/mechanism/goal_run_status.py::build_report:219",
        "ops/scripts/mechanism/goal_runtime_certificate_report.py::build_report:898",
        "ops/scripts/mechanism/goal_runtime_runner.py::_status_report:183"
      ],
      "recommended_strategy": "owner_review_required_before_refactor",
      "next_owner_action": "Treat this as design backlog, not an automatic refactor proposal."
    },
    {
      "backlog_id": "function-budget-tests-test-external-report-action-matrix-py-test-helper-design-backlog-1",
      "owner_surface": "tests/test_external_report_action_matrix.py",
      "scope_class": "test_helper",
      "backlog_theme": "test_helper_design_backlog",
      "priority": "P2",
      "candidate_count": 1,
      "high_risk_count": 0,
      "medium_risk_count": 1,
      "low_risk_count": 0,
      "dominant_blockers": [
        "function_line_overage_too_large_for_small_adapter"
      ],
      "candidate_symbols": [
        "tests/test_external_report_action_matrix.py::ExternalReportActionMatrixTests.test_goal_native_actions_require_current_canonical_runtime_reports:511"
      ],
      "recommended_strategy": "split_fixture_or_assertion_helpers_when_tests_change",
      "next_owner_action": "Avoid churn-only test refactors; split helpers alongside the next behavior change."
    },
    {
      "backlog_id": "function-budget-tests-test-generated-report-contracts-py-test-helper-design-backlog-1",
      "owner_surface": "tests/test_generated_report_contracts.py",
      "scope_class": "test_helper",
      "backlog_theme": "test_helper_design_backlog",
      "priority": "P2",
      "candidate_count": 1,
      "high_risk_count": 0,
      "medium_risk_count": 0,
      "low_risk_count": 1,
      "dominant_blockers": [
        "multiple_budget_axes_triggered"
      ],
      "candidate_symbols": [
        "tests/test_generated_report_contracts.py::test_checked_in_auto_improve_readiness_reflects_trial_only_authority_preflight_state:1146"
      ],
      "recommended_strategy": "split_fixture_or_assertion_helpers_when_tests_change",
      "next_owner_action": "Avoid churn-only test refactors; split helpers alongside the next behavior change."
    },
    {
      "backlog_id": "function-budget-tests-test-makefile-static-gates-py-test-helper-design-backlog-2",
      "owner_surface": "tests/test_makefile_static_gates.py",
      "scope_class": "test_helper",
      "backlog_theme": "test_helper_design_backlog",
      "priority": "P2",
      "candidate_count": 2,
      "high_risk_count": 0,
      "medium_risk_count": 2,
      "low_risk_count": 0,
      "dominant_blockers": [
        "function_line_overage_too_large_for_small_adapter"
      ],
      "candidate_symbols": [
        "tests/test_makefile_static_gates.py::MakefileStaticGateTests.test_release_smoke_targets_expose_fast_and_full_profiles:1437",
        "tests/test_makefile_static_gates.py::MakefileStaticGateTests.test_auto_improve_goal_targets_write_contract_and_status_report:2997"
      ],
      "recommended_strategy": "split_fixture_or_assertion_helpers_when_tests_change",
      "next_owner_action": "Avoid churn-only test refactors; split helpers alongside the next behavior change."
    }
  ],
  "candidates": [
    {
      "page": "ops/scripts/core/codex_goal_client.py",
      "symbol": "build_auto_improve_goal_contract",
      "line": 354,
      "profile": "runtime",
      "owner_surface": "ops/scripts",
      "scope_class": "script_or_report_helper",
      "risk_tier": "low",
      "triggered_budgets": [
        "function_lines",
        "parameter_count"
      ],